<?xml  version="1.0" encoding="ISO-8859-1" ?>
<!DOCTYPE adressbuch SYSTEM "adrbuch.dtd">
<adressbuch >
	<adresse>
		<firma>
			<firmenname >Uni  Bonn</firmenname >
			<abteilung >Informatik  III</abteilung >
		</firma>
		<strasse >Römerstraße  164</strasse >
		<plz>53117</plz>
		<ort>Bonn</ort>
	</adresse >
	<adresse >
		<person  titel="Herr">
			<vorname >Manfred </vorname >
			<nachname >Mustermann </nachname >
		</person >
		<strasse >Am  Friedhof  11a</strasse >
		<plz>12345</plz>
		<ort>Irgendwo </ort>
	</adresse >
	<adresse  land="uk">
		<person  titel="Family">
			<nachname >Anyone </nachname >
		</person >
		<strasse >47 Eden  Street </strasse >
		<ort>Cambridge </ort>
		<postcode >CB1 1JR</postcode >
	</adresse>
	<adresse  land="us">
		<firma>
			<firmenname >Old  Whiskey  Brewery </firmenname >
		</firma>
		<strasse >8 Oak  Avenue </strasse >
		<ort>Old  Town</ort>
		<state>PA</state>
		<zip>95819</zip>
	</adresse>
</adressbuch>